series_animedb_id,series_title,series_type,series_episodes,my_id,my_watched_episodes,my_start_date,my_finish_date,my_rated,my_score,my_storage,my_storage_value,my_status,my_comments,my_times_watched,my_rewatch_value,my_priority,my_tags,my_rewatching,my_rewatching_ep,my_discuss,my_sns,update_on_import,Unnamed: 0,Type,Score,Score Rank,Popularity Rank,Air Date,Studio,Num. of episodes,Genres,Theme(s),Demographic
270,Hellsing,TV,13,0,13,2022-09-04,2022-09-12,,4,,0,Completed,,0,,LOW,"Hellsing é um caso curioso, mesmo sendo divertido de assistir, sua história parece mais uma desculpa para sanguinolência do que uma tentativa de fazer algo minimamente coeso",0,0,1,default,0,1694.0,TV,7.49,1695.0,244.0,"Oct 11, 2001 to Jan 17, 2002",['Gonzo'],13.0,"['Action', 'Horror', 'Supernatural']","['Adult Cast', 'Gore', 'Vampire']",Seinen
379,Heppoko Jikken Animation Excel♥Saga,TV,26,0,26,0000-00-00,0000-00-00,,5,,0,Completed,,0,,LOW,"O que estão dando para esses Japoneses???? É muito engraçado, mas o fato de ser tão episódico quebra bastante o ritmo do anime",0,0,1,default,0,1695.0,TV,7.49,1696.0,1722.0,"Oct 8, 1999 to Mar 31, 2000",['J.C.Staff'],26.0,"['Comedy', 'Sci-Fi']","['Gag Humor', 'Parody']",Seinen
38628,Hero Mask,ONA,15,0,15,2023-12-21,2023-12-23,,1,,0,Completed,,0,,LOW,"Dizer que a produção é horrível, seria chover no molhado, mas pelo menos se tivesse uma história bacana a história seria outra. Os personagens são terrivelmente caricatos e o ritmo é enfadonho, quando um episódio acabava eu não queria ver o pró",0,0,1,default,0,,,,,,,,,,,
40938,Hige wo Soru. Soshite Joshikousei wo Hirou.,TV,13,0,0,0000-00-00,0000-00-00,,0,,0,Plan to Watch,,0,,LOW,,0,0,1,default,0,,,,,,,,,,,
53438,Higeki no Genkyou to Naru Saikyou Gedou Last Boss Joou wa Tami no Tame ni Tsukushimasu.,TV,12,0,12,2023-07-06,2023-09-21,,2,,0,Completed,,0,,LOW,"Aquele tipo de história que você tem a sensação de já ter visto uma duas ou três vezes, não empolga e a produção é realmente sofrível.",0,0,0,default,0,,,,,,,,,,,
11617,High School DxD,TV,12,0,12,0000-00-00,2022-01-20,,2,,0,Completed,,0,,LOW,"Ecchi pesado para atrair crianças de 10 até 14 anos. Quem diz que assiste pela história está mentindo, já que a mesma não existe, né Vitor",0,0,1,default,0,,,,,,,,,,,
21877,High Score Girl,TV,12,0,12,0000-00-00,0000-00-00,,4,,0,Completed,,0,,LOW,"Assisti com meu irmão mais velho, e ele não conseguia parar de achar referências, então pelo menos isso eles fizeram direito",0,0,1,default,0,895.0,TV,7.79,896.0,872.0,"Jul 14, 2018 to Sep 29, 2018",['J.C.Staff'],12.0,['Comedy'],"['Love Polygon', 'Romantic Subtext', 'School', 'Video Game']",Seinen
39570,High Score Girl II,TV,9,0,9,0000-00-00,0000-00-00,,6,,0,Completed,,0,,LOW,"Interessante, realmente não esperava uma melhora considerável em relação a primeira temporada",0,0,1,default,0,580.0,TV,7.99,581.0,1531.0,"Oct 26, 2019 to Dec 21, 2019",['J.C.Staff'],9.0,['Comedy'],"['Love Polygon', 'Romantic Subtext', 'School', 'Video Game']",Seinen
8074,Highschool of the Dead,TV,12,0,12,0000-00-00,0000-00-00,,2,,0,Completed,,0,,LOW,"Olha como eu sou adulto gente, eu assisto anime e ele tem sangue (Mas só isso também)",0,0,1,default,0,,,,,,,,,,,
934,Higurashi no Naku Koro ni,TV,26,0,26,0000-00-00,0000-00-00,,3,,0,Completed,,0,,LOW,"A direção até consegue criar momentos de tensão, mas a animação é tão ruim que fica engraçado",0,0,1,default,0,720.0,TV,7.9,721.0,202.0,"Apr 5, 2006 to Sep 27, 2006",['Studio Deen'],26.0,"['Horror', 'Mystery', 'Supernatural', 'Suspense']","['Gore', 'Psychological']",
41006,Higurashi no Naku Koro ni Gou,TV,24,0,24,2021-12-12,2021-12-28,,4,,0,Completed,,0,,LOW,"Eles até tentam melhorar a obra original, mas a mudança é muito sutil",0,0,1,default,0,,,,,,,,,,,
1889,Higurashi no Naku Koro ni Kai,TV,24,0,24,2020-12-16,2020-12-28,,3,,0,Completed,,0,,LOW,"O auge da franquia, a animação melhora um pouco e a direção entende suas limitações, mas milagre quem faz é Deus",0,0,1,default,0,338.0,TV,8.19,339.0,408.0,"Jul 6, 2007 to Dec 18, 2007",['Studio Deen'],24.0,"['Mystery', 'Supernatural', 'Suspense']","['Gore', 'Psychological']",
3652,Higurashi no Naku Koro ni Rei,OVA,5,0,5,2020-12-28,2020-12-29,,3,,0,Completed,,0,,LOW,Parece que a esquecem tudo que aprenderam,0,0,1,default,0,1955.0,OVA,7.42,1956.0,1062.0,"Feb 25, 2009 to Aug 21, 2009",['Studio Deen'],5.0,"['Comedy', 'Mystery', 'Supernatural', 'Suspense']","['Gore', 'Psychological']",
43760,Hikari no Ou,TV,10,0,10,2023-01-14,2023-03-18,,4,,0,Completed,,0,,LOW,"A ideia é muito interessante, porém falha em apresentar algo de realmente interessante, acho que deveriam ter focado mais no mundo em si ao invés de priorizar a história da pirralha",0,0,1,default,0,,,,,,,,,,,
36884,Hisone to Maso-tan,TV,12,0,12,2022-05-31,2022-06-01,,8,,0,Completed,,0,,LOW,"🥉: Toscão, não é o primor da comédia, mas arrancou umas boa rizadas. Surpresa muito positiva",0,0,1,default,0,,,,,,,,,,,
18953,Hitotsubu ni Kawaranu Ai wo Komete,ONA,1,0,1,2023-10-14,2023-10-14,,5,,0,Completed,,0,,LOW,Impressionante como um comercial de 3 minutos de uma marca de confeito de caramelo é melhor que toda a filmografia do Makoto Shinkai.,0,0,1,default,0,,,,,,,,,,,
55115,Hokkyoku Hyakkaten no Concierge-san,Movie,1,0,0,0000-00-00,0000-00-00,,0,,0,Plan to Watch,,0,,LOW,,0,0,1,default,0,,,,,,,,,,,
39468,Honzuki no Gekokujou: Shisho ni Naru Tame ni wa Shudan wo Erandeiraremasen,TV,14,0,14,0000-00-00,0000-00-00,,6,,0,Completed,,0,,LOW,Um Tensei que finalmente entende que mais luta é diferente de melhor.,0,0,1,default,0,555.0,TV,8.01,556.0,858.0,"Oct 3, 2019 to Dec 26, 2019",['Ajia-Do'],14.0,"['Fantasy', 'Slice of Life']","['Isekai', 'Reincarnation']",
40815,Honzuki no Gekokujou: Shisho ni Naru Tame ni wa Shudan wo Erandeiraremasen 2nd Season,TV,12,0,12,0000-00-00,0000-00-00,,7,,0,Completed,,0,,LOW,"🥉: Uma melhora do original em todos os sentidos, o exemplo do que deve ser uma segunda temporada",0,0,1,default,0,401.0,TV,8.13,402.0,1254.0,"Apr 5, 2020 to Jun 21, 2020",['Ajia-Do'],12.0,"['Fantasy', 'Slice of Life']","['Isekai', 'Reincarnation']",
20431,Hoozuki no Reitetsu,TV,13,0,13,2023-12-02,2023-12-03,,8,,0,Completed,,0,,LOW,"🥉: Talvez a experiência mais curiosa que eu já tive com um anime de comédia, mesmo sem me arrancar grandes risadas, conseguiu me cativar muito por suas sacadas na hora de utilizar as crenças japonesas na construção das piadas. Muito obrigado @nol",0,0,1,default,0,920.0,TV,7.78,921.0,1479.0,"Jan 10, 2014 to Apr 4, 2014",['Wit Studio'],13.0,"['Comedy', 'Fantasy', 'Supernatural']",['Mythology'],Seinen
35075,Hoozuki no Reitetsu 2nd Season,TV,13,0,13,2023-12-04,2023-12-06,,8,,0,Completed,,0,,LOW,"🥉: Acredito piamente que eles conseguiram elevar o nível das sacadas de uma forma assustadora. Dessa vez sim tive algumas boas gargalhadas, principalmente com a personagem da Mostarda, a pior parte foi ter acabado. Que venha a terceira temporada.",0,0,1,default,0,746.0,TV,7.88,747.0,2869.0,"Oct 8, 2017 to Dec 31, 2017",['Studio Deen'],13.0,"['Comedy', 'Fantasy', 'Supernatural']",['Mythology'],Seinen
39538,Hoozuki no Reitetsu 2nd Season OVA,OVA,3,0,3,2023-12-09,2023-12-09,,7,,0,Completed,,0,,LOW,"A dificuldade de achar isso aqui, pelo amor de Deus, mas valeu a pena",0,0,1,default,0,1739.0,OVA,7.48,1740.0,7459.0,"Sep 20, 2019 to Sep 1, 2020",['Pine Jam'],3.0,"['Comedy', 'Fantasy', 'Supernatural']",['Mythology'],Seinen
37029,Hoozuki no Reitetsu 2nd Season: Sono Ni,TV,13,0,13,2023-12-08,2023-12-08,,9,,0,Completed,,0,,LOW,"🥉: 8.5, Está oficializado, Hoozuki professor de mitologia japonesa é um dos meus personagens favoritos! Que temporada senhores, finalmente a Mostarda, a melhor personagem, ganhou seu merecido destaque!!!!",0,0,1,default,0,790.0,TV,7.85,791.0,3728.0,"Apr 8, 2018 to Jul 1, 2018",['Studio Deen'],13.0,"['Comedy', 'Fantasy', 'Supernatural']",['Mythology'],Seinen
24471,Hoozuki no Reitetsu OVA,OVA,4,0,4,2023-12-09,2023-12-09,,8,,0,Completed,,0,,LOW,Ahhhhh como eu deveria ter assistido esse especial antes da segunda temporada.,0,0,1,default,0,778.0,OVA,7.86,779.0,4584.0,"Feb 23, 2015 to Mar 23, 2017","['Studio Deen', '            Wit Studio']",4.0,"['Comedy', 'Fantasy', 'Supernatural']",['Mythology'],Seinen
42897,Horimiya,TV,13,0,13,2021-10-18,2021-10-19,,3,,0,Completed,,0,,LOW,"Adaptar 125 capítulos em 13 episódios fez com que todas as relações fiquem extremamente rasas, incluindo a principal",0,0,1,default,0,313.0,TV,8.21,314.0,117.0,"Jan 10, 2021 to Apr 4, 2021",['CloverWorks'],13.0,"['Comedy', 'Romance', 'Slice of Life']",['School'],Shounen
256,Hoshi no Koe,OVA,1,0,1,2022-01-27,2022-01-27,,2,,0,Completed,,0,,LOW,"Não tem nenhuma construção de mundo, a lógica não se sustenta de forma alguma. Parece que a protagonista não tem pai, mãe ou qualquer outro amigo, já que ela só lembra do namorado. E para finalizar COMO UM CELULAR TEM ÁREA 8 ANOS LUZ da terra?",0,0,1,default,0,,,,,,,,,,,
50891,Hoshi no Samidare,TV,24,0,24,0000-00-00,2022-12-23,,6,,0,Completed,,0,,LOW,"Eu compreendo completamente todas as críticas as animações e qualidade da produção do anime, mas eu não consigo ver isso sendo feito de sacanagem, os caras tiveram um orçamento de meia coxinha e uma Pepsi sem gás, mas história está lá",0,0,1,default,0,,,,,,,,,,,
9760,Hoshi wo Ou Kodomo,Movie,1,0,1,2022-01-28,2022-01-28,,4,,0,Completed,,0,,LOW,"Tem os visuais que parecidos com os Ghibli, ou seja são muito bons. Mas o filme é mais longo do que precisa",0,0,1,default,0,1547.0,Movie,7.54,1547.0,1007.0,"May 7, 2011",['CoMix Wave Films'],1.0,"['Adventure', 'Fantasy', 'Romance']",['None'],
37972,Hoshiai no Sora,TV,12,0,12,0000-00-00,0000-00-00,,4,,0,Completed,,0,,LOW,"Um potencial 8 até o episódio de mesmo número, contudo a mudança da narrativa de um anime de tênis para um suspense",0,0,1,default,0,1367.0,TV,7.59,1368.0,1128.0,"Oct 11, 2019 to Dec 27, 2019",['8bit'],12.0,"['Drama', 'Sports']",['School'],
53262,Hoshikuzu Telepath,TV,12,0,12,2023-10-09,2023-12-25,,2,,0,Completed,,0,,LOW,"Quase não consegui assistir de tanta vergonha alheia, simplesmente intankavel uma menina do ensino médio acreditando nessas besteiras.",0,0,0,default,0,,,,,,,,,,,
578,Hotaru no Haka,Movie,1,0,1,0000-00-00,0000-00-00,,8,,0,Completed,,0,,LOW,🥈: Mudei muito minha opinião sobre esse filme quando o peguei para rever. Como é bom apreciar uma boa obra,0,0,1,default,0,110.0,Movie,8.51,111.0,303.0,"Apr 16, 1988",['Studio Ghibli'],1.0,['Drama'],['Historical'],
56425,Houkago Shounen Hanako-kun,TV,4,0,4,2023-10-10,2023-10-31,,3,,0,Completed,,0,,LOW,Definitivamente um dos animes mais feitos (E talvez mais chatos também),0,0,1,default,0,,,,,,,,,,,
431,Howl no Ugoku Shiro,Movie,1,0,1,0000-00-00,0000-00-00,,8,,0,Completed,,0,,LOW,"🥈: Um filme bem de nicho, mas com a qualidade padrão Ghibli",0,0,1,default,0,61.0,Movie,8.66,62.0,96.0,"Nov 20, 2004",['Studio Ghibli'],1.0,"['Adventure', 'Drama', 'Fantasy', 'Romance']",['None'],
136,Hunter x Hunter,TV,62,0,62,2016-06-02,2016-08-02,,8,,0,Completed,,0,,LOW,🥉: Shounenzão brabo,0,0,1,default,0,164.0,TV,8.4,165.0,342.0,"Oct 16, 1999 to Mar 31, 2001",['Nippon Animation'],62.0,"['Action', 'Adventure', 'Fantasy']",['None'],Shounen
11061,Hunter x Hunter (2011),TV,148,0,28,2023-08-21,0000-00-00,,0,,0,On-Hold,,0,,LOW,"Não tenho mais saco de assistir HxH, acho que estou ficando velho",0,0,1,default,0,7.0,TV,9.05,8.0,10.0,"Oct 2, 2011 to Sep 24, 2014",['Madhouse'],148.0,"['Action', 'Adventure', 'Fantasy']",['None'],Shounen
12189,Hyouka,TV,22,0,22,2023-08-02,2023-08-04,,8,,0,Completed,,0,,LOW,"🥉: Acho que, para começar, vale falar que, mesmo que o Oreki pertença a um arquétipo de personagem que não me agrada seu papel na obra foi extremamente satisfatório. O ritmo dos primeiros episódios é muito agradável, mesmo que ele se perca um p",0,0,1,default,0,446.0,TV,8.1,447.0,87.0,"Apr 23, 2012 to Sep 17, 2012",['Kyoto Animation'],22.0,"['Mystery', 'Slice of Life']",['School'],
51711,Hyouken no Majutsushi ga Sekai wo Suberu,TV,12,0,12,2024-08-27,2024-08-28,,1,,0,Completed,,0,,LOW,"É o famoso anime 2x, parece que todas as relações dos personagens são muito aceleradas, cenas são muito cortadas e você quase não consegue se conectar com nada do que está acontecendo na obra. Tudo é muito genérico, muito artificial",0,0,0,disallow,0,,,,,,,,,,,
42361,"Ijiranaide, Nagatoro-san",TV,12,0,12,2022-01-17,0000-00-00,,4,,0,Completed,,0,,LOW,"Vergonha Alheia demais, não é nem que seja ruim, mas pelo amor",0,0,1,default,0,,,,,,,,,,,
50197,"Ijiranaide, Nagatoro-san 2nd Attack",TV,12,0,12,0000-00-00,2023-04-25,,5,,0,Completed,,0,,LOW,O exemplo perfeito do que é Nagatoro é que eu simplesmente esqueci completamente de assistir os 2 últimos episódios kkkkkkk,0,0,1,default,0,,,,,,,,,,,
5231,Inazuma Eleven,TV,127,0,127,0000-00-00,0000-00-00,,4,,0,Completed,,0,,LOW,Não é ruim para um anime de futebol com poderzinho,0,0,1,default,0,1242.0,TV,7.64,1243.0,1047.0,"Oct 5, 2008 to Apr 27, 2011",['OLM'],127.0,['Sports'],"['Super Power', 'Team Sports']",Shounen
13261,Inazuma Eleven Go: Chrono Stone,TV,51,0,51,0000-00-00,0000-00-00,,4,,0,Completed,,0,,LOW,Mais futebol com poderzinho,0,0,1,default,0,,,,,,,,,,,
16774,Inferno Cop,ONA,13,0,13,2023-02-23,2023-02-23,,8,,0,Completed,,0,,LOW,"🥉: Kkkkkkkk, não consigo achar que o cara que inventou essa história estava em suas plenas faculdades mentais, é completamente estúpido e é tão ruim que dá a volta e fica bom",0,0,1,default,0,,,,,,,,,,,
185,Initial D First Stage,TV,26,0,26,0000-00-00,0000-00-00,,8,,0,Completed,,0,,LOW,🥈: Interessante como os personagens conseguem ter uma conversa técnica sobre carros manuais dos anos 90/2000 sem parecer robótico ou te fazer se sentir um leigo idiota,0,0,1,default,0,229.0,TV,8.31,230.0,625.0,"Apr 19, 1998 to Dec 6, 1998","['Gallop', '            Studio Comet']",26.0,"['Action', 'Drama']",['Racing'],Seinen
18,Initial D Fourth Stage,TV,24,0,24,0000-00-00,0000-00-00,,4,,0,Completed,,0,,LOW,"De muito longe o ponto mais fraco da série, é verdadeiramente decepcionante ver a queda na qualidade textual e o rumo por vezes tedioso da história",0,0,1,default,0,377.0,TV,8.15,378.0,1259.0,"Apr 17, 2004 to Feb 18, 2006",['A.C.G.T.'],24.0,"['Action', 'Drama']",['Racing'],Seinen
186,Initial D Second Stage,TV,13,0,13,0000-00-00,0000-00-00,,8,,0,Completed,,0,,LOW,"🥇: Eu sou oficialmente feliz vendo pessoas fazendo drift, obrigado Horizon Chase Turbo e obrigado Takumi seu gado",0,0,1,default,0,391.0,TV,8.14,392.0,1084.0,"Oct 15, 1999 to Jan 21, 2000",['Pastel'],13.0,"['Action', 'Drama']",['Racing'],Seinen
187,Initial D Third Stage,Movie,1,0,1,0000-00-00,0000-00-00,,6,,0,Completed,,0,,LOW,"Realmente um filme muito competente, mesmo que um pouco menos impressionante que o anime",0,0,1,default,0,747.0,Movie,7.88,748.0,1293.0,"Jan 13, 2001",['Studio Deen'],1.0,"['Action', 'Drama', 'Romance']",['Racing'],Seinen
51265,Inu ni Nattara Suki na Hito ni Hirowareta.,TV,12,0,12,2023-01-06,2023-03-24,,1,,0,Completed,,0,,LOW,"Não só é doentio, mas também tem a audácia de TERMINAR EM ABERTO, ESSA DESGRAÇA NÃO SATISFEITA EM ME FAZER VER 12 EPISÓDIOS TERMINA EM ABERTO!",0,0,1,default,0,,,,,,,,,,,
54357,Inu to Shounen,ONA,1,0,1,2024-03-04,2024-03-04,,3,,0,Completed,,0,,LOW,"Vim assistir pela curiosidade, e é impressionante o que a inteligência é capaz de fazer hoje (Não em termos de texto, porque isso ainda está bem incipiente). Não sei o motivo da Netflix ter excluído isso do seu catálogo.",0,0,1,default,0,,,,,,,,,,,
39938,Inu-Ou,Movie,1,0,1,2023-12-15,2023-12-15,,9,,0,Completed,,0,,LOW,"💎: Esse filme junta tudo que eu não gosto, musicais e apresentações espalhafatosas, mas ele é tão belo e a melodia encaixa tão bem com as cenas que eu fiquei hipnotizado até o fim. Para os amantes de música esse filme é um deleite, o prato pri",0,0,1,default,0,,,,,,,,,,,
249,InuYasha,TV,167,0,167,0000-00-00,0000-00-00,,4,,0,Completed,,0,,LOW,Ao mesmo tempo que possui ótimos episódios divide tempo com outros desnecessariamente enrolados,0,0,1,default,0,791.0,TV,7.85,792.0,220.0,"Oct 16, 2000 to Sep 13, 2004",['Sunrise'],167.0,"['Action', 'Adventure', 'Comedy', 'Fantasy', 'Romance', 'Supernatural']","['Historical', 'Mythology', 'Time Travel']",Shounen
52830,"Isekai de Cheat Skill wo Te ni Shita Ore wa, Genjitsu Sekai wo mo Musou Suru: Level Up wa Jinsei wo Kaeta",TV,13,0,13,2024-07-05,2024-07-08,,2,,0,Completed,,0,,LOW,"Difícil viu, difícil... Os caras até tentaram passar a mensagem clássica ""Quem vê cara não vê coração"" mas acho que o efeito foi quase o oposto kkkkkkkk.",0,0,1,default,0,,,,,,,,,,,
44524,Isekai Meikyuu de Harem wo,TV,12,0,12,0000-00-00,2022-09-21,,3,,0,Completed,,0,,LOW,"De alguma forma completamente maluca a parte do Isekai é o menor dos problemas, até funcionando surpreendentemente de forma razoável, a questão é que tudo vira desculpa para regredir aos instintos mais básicos da humanidade",0,0,1,default,0,,,,,,,,,,,
49220,Isekai Ojisan,TV,13,0,13,2023-04-17,2023-04-17,,5,,0,Completed,,0,,LOW,"Completamente estupido e muito criativo, realmente uma forma bem diferente de se apresentar um isekai",0,0,1,default,0,,,,,,,,,,,
51219,Isekai One Turn Kill Neesan: Ane Douhan no Isekai Seikatsu Hajimemashita,TV,12,0,12,2023-05-27,2023-06-23,,1,,0,Completed,,0,,LOW,"Parece que foi algo criado somente para o autor expressar seu fetiche em sua irmã, intankavel. A única coisa que presta é o encerramento",0,0,1,default,0,,,,,,,,,,,
52367,Isekai Shikkaku,TV,12,0,9,2024-07-09,0000-00-00,,6,,0,Watching,,0,,LOW,,0,0,1,default,0,,,,,,,,,,,
55848,Isekai Suicide Squad,TV,10,0,10,2024-06-26,2024-08-15,,4,,0,Completed,,0,,LOW,"Decepcionante, não tem outra forma de colocar isso. Um potencial desperdiçado por uma história sem brilho e uma escolha de elenco estranha, honestamente acho que só a Harley e o Pacificador se salvam.",0,0,1,default,0,,,,,,,,,,,
35203,Isekai wa Smartphone to Tomo ni.,TV,12,0,12,0000-00-00,0000-00-00,,1,,0,Completed,,0,,LOW,"""Isekai wa Smartphone to Tomo ni Sinônimo: Genérico, sem alma, podre"" ""Dicionário""",0,0,1,default,0,,,,,,,,,,,
57380,Isekai Yururi Kikou: Kosodateshinagara Boukensha Shimasu,TV,12,0,9,2024-07-07,0000-00-00,,3,,0,Watching,,0,,LOW,,0,0,1,default,0,,,,,,,,,,,
54449,Ishura,TV,12,0,2,2024-01-03,0000-00-00,,1,,0,Dropped,,0,,LOW,"Por ser passione eu vim assistir, mas é impossível, eles não sabem fazer um anime sério",0,0,1,default,0,,,,,,,,,,,
40010,Ishuzoku Reviewers,TV,12,0,12,0000-00-00,0000-00-00,,7,,0,Completed,,0,,LOW,"🥉: Vim ver só pela grande polêmica gerada, mas me surpreendi positivamente, justamente por não se levar a sério e ser bem exagerado consegue criar uma comedia realmente engraçado. Porém, o mangá é ainda melhor kkkkkk",0,0,1,default,0,1752.0,TV,7.47,1753.0,441.0,"Jan 11, 2020 to Mar 28, 2020",['Passione'],12.0,"['Comedy', 'Fantasy', 'Ecchi']",['Anthropomorphic'],
48753,Jahy-sama wa Kujikenai!,TV,20,0,20,2022-11-14,2022-11-15,,5,,0,Completed,,0,,LOW,"Não é ruim, tem seus momentos engraçados, a premissa funciona para uma comédia e no geral é um entretenimento aceitável",0,0,1,default,0,,,,,,,,,,,
39534,Jibaku Shounen Hanako-kun,TV,12,0,12,2021-10-17,2021-10-18,,7,,0,Completed,,0,,LOW,Despretensioso e Engraçado com um design de personagem bem interessante,0,0,1,default,0,792.0,TV,7.85,793.0,376.0,"Jan 10, 2020 to Mar 27, 2020",['Lerche'],12.0,"['Comedy', 'Supernatural']",['School'],Shounen
52619,Jidou Hanbaiki ni Umarekawatta Ore wa Meikyuu wo Samayou,TV,12,0,12,2023-07-05,2023-09-20,,2,,0,Completed,,0,,LOW,"Imaginar que alguém aprovou isso me deixa desanimado com o futuro da indústria. Ok, não é nem de longe o pior anime que eu já vi, mas claramente eles esticaram muito uma piada (ruim) que caberia em um episódio.",0,0,0,default,0,,,,,,,,,,,
46569,Jigokuraku,TV,13,0,13,2023-04-01,2023-07-01,,3,,0,Completed,,0,,LOW,"""Gente andando no mato enquanto nada de bom acontece"". Treine centenas de anos um estilo de luta e seja derrotado por um cara que nem sabia que isso existia 2 minutos atrás. Mas esses últimos 5 minutos... São finos",0,0,0,default,0,,,,,,,,,,,
56230,Jiisan Baasan Wakagaeru,TV,11,0,11,2024-04-07,2024-06-16,,7,,0,Completed,,0,,LOW,"Engraçadinho, gostosinho de assistir e tem personagens interessantes e alguns momentos realmente tocantes, como o final (ABSOLUTE CINEMA)",0,0,1,default,0,,,,,,,,,,,
53621,Jijou wo Shiranai Tenkousei ga Guigui Kuru.,TV,13,0,13,2023-04-02,2023-06-25,,7,,0,Completed,,0,,LOW,"(Ou ""Meu primeiro amigo é um tabacudo"")
Vou resumir em uma palavra: Fofo",0,0,0,disallow,0,,,,,,,,,,,
570,Jin-Rou,Movie,1,0,1,2024-01-26,2024-01-26,,9,,0,Completed,,0,,LOW,"🥈🥉: Esse filme é visualmente lindo, principalmente seus cenários. E para complementar, ainda tem os fusquinhas, o que mais eu poderia pedir? Por outro lado, seu único defeito é que nenhum dos personagens é muito interessante.",0,0,1,default,0,923.0,Movie,7.78,924.0,1271.0,"Jun 3, 2000",['Production I.G'],1.0,"['Drama', 'Romance']","['Adult Cast', 'Detective', 'Military', 'Psychological']",
14719,JoJo no Kimyou na Bouken (TV),TV,26,0,26,0000-00-00,0000-00-00,,7,,0,Completed,,0,,LOW,"🥉:A parte um é terrivelmente chata. Já a parte dois é GENIAL, tudo funciona perfeitamente bem, um casamento perfeito entre protagonista e história (Nota: 9)",0,0,1,default,0,683.0,TV,7.92,684.0,65.0,"Oct 6, 2012 to Apr 6, 2013",['David Production'],26.0,"['Action', 'Adventure', 'Supernatural']",['Vampire'],Shounen
20899,JoJo no Kimyou na Bouken Part 3: Stardust Crusaders,TV,24,0,24,0000-00-00,0000-00-00,,6,,0,Completed,,0,,LOW,O Jotaro definitivamente não é um bom protagonista mas o elenco é muito forte,0,0,1,default,0,447.0,TV,8.1,448.0,115.0,"Apr 5, 2014 to Sep 13, 2014",['David Production'],24.0,"['Action', 'Adventure', 'Drama', 'Supernatural']",['None'],Shounen
26055,JoJo no Kimyou na Bouken Part 3: Stardust Crusaders 2nd Season,TV,24,0,24,0000-00-00,0000-00-00,,6,,0,Completed,,0,,LOW,Não imaginava que fosse me apegar tanto a personagens de Jojo,0,0,1,default,0,143.0,TV,8.44,144.0,133.0,"Jan 10, 2015 to Jun 20, 2015",['David Production'],24.0,"['Action', 'Adventure', 'Drama', 'Supernatural']",['None'],Shounen
31933,JoJo no Kimyou na Bouken Part 4: Diamond wa Kudakenai,TV,39,0,39,2021-11-19,2021-12-02,,8,,0,Completed,,0,,LOW,"Ótimos personagens, o melhor vilão de Jojo e um destaque especial no clima criado na cidade de Morioh",0,0,1,default,0,119.0,TV,8.5,120.0,132.0,"Apr 2, 2016 to Dec 24, 2016",['David Production'],39.0,"['Action', 'Adventure', 'Comedy', 'Drama', 'Supernatural']",['None'],Shounen
37991,JoJo no Kimyou na Bouken Part 5: Ougon no Kaze,TV,39,0,39,2023-12-10,2023-12-11,,8,,0,Completed,,0,,LOW,"🥉🥈: A temática dessa temporada me agrada muito, além de que esse, na minha visão, é o grupo mais orgânico de Jojo até aqui, sinto que o Giorno compartilha muito mais o seu protagonismo com os outros. Porém é uma pena que o Diavolo seja um vi",0,0,1,default,0,78.0,TV,8.58,79.0,159.0,"Oct 6, 2018 to Jul 28, 2019",['David Production'],39.0,"['Action', 'Adventure']",['Organized Crime'],Shounen
48661,JoJo no Kimyou na Bouken Part 6: Stone Ocean,ONA,12,0,12,2023-12-11,2023-12-12,,7,,0,Completed,,0,,LOW,"🥈: A questão de se passar em um único cenário poderia ser um fator de desinteresse grande na história, mas o Araki realmente se superou na criatividade de imaginar diferentes situações por aqui. Só me incomoda um pouco essa volta para o Dio, de ",0,0,1,default,0,145.0,ONA,8.43,146.0,584.0,"Dec 1, 2021",['David Production'],12.0,"['Action', 'Adventure']",['None'],Shounen
51367,JoJo no Kimyou na Bouken Part 6: Stone Ocean Part 2,ONA,12,0,12,2023-12-12,2023-12-13,,6,,0,Completed,,0,,LOW,"A FF resume minha experiência com essa temporada, uma boa personagem que não foi bem aproveitada graças ao ritmo bizarramente acelerado.",0,0,1,default,0,,,,,,,,,,,
53273,JoJo no Kimyou na Bouken Part 6: Stone Ocean Part 3,ONA,14,0,14,2023-12-13,2023-12-13,,8,,0,Completed,,0,,LOW,"O Araki brincou com fogo aqui, meu amigo,estragar o final e abrir margem para uma nova história estavam separados por uma linha tênue. Mas acredito que de forma geral o saldo foi positivo, o único problema é que a história é muito corrida.",0,0,1,default,0,,,,,,,,,,,
31405,Joker Game,TV,12,0,12,0000-00-00,0000-00-00,,2,,0,Completed,,0,,LOW,Não tem nada de marcante além de ser muito tosco,0,0,1,default,0,,,,,,,,,,,
40748,Jujutsu Kaisen,TV,24,0,24,0000-00-00,0000-00-00,,8,,0,Completed,,0,,LOW,🥈: Mesmo para um uma obra despretensiosa a qualidade do texto é básica‚ tem boas batalhas e personagens carismáticos,0,0,1,default,0,1076.0,ONA,7.71,1077.0,2849.0,"Dec 3, 2018 to Dec 8, 2018",['Yokohama Animation Lab'],3.0,['Fantasy'],['School'],Shounen
48561,Jujutsu Kaisen 0 Movie,Movie,1,0,1,2023-02-22,2023-02-22,,6,,0,Completed,,0,,LOW,"Uma ótima introdução (ou continuação) de Jujutsu, ficou claro como foi investida uma grana para fazer esse filme, a direção de arte é um espetáculo",0,0,1,default,0,100.0,Movie,8.53,101.0,496.0,"Dec 24, 2021",['MAPPA'],1.0,"['Action', 'Fantasy']",['School'],Shounen
51009,Jujutsu Kaisen 2nd Season,TV,23,0,23,2023-07-06,2024-01-19,,9,,0,Completed,,0,,LOW,"🥉🥈: Tenho que dar o braço a torcer e admitir que a MAPPA fez um baita trabalho nessa adaptação, fiquei assustado com a qualidade. Dito isso, o trio de protagonistas umas portas sem graça, e os personagens secundários são muito melhores",0,0,1,default,0,,,,,,,,,,,
2556,Jungle Taitei (1989),TV,52,0,52,2019-02-16,2019-06-10,,3,,0,Completed,,0,,LOW,Vale a pena ver com uma criança pequena,0,0,1,default,0,,,,,,,,,,,
2264,Jungle Taitei Movie (1997),Movie,1,0,1,0000-00-00,0000-00-00,,3,,0,Completed,,0,,LOW,"Não,Rei Leão não copiou Kimba o Leão branco https://www.youtube.com/watch?v=qh8eSvp_KDI",0,0,1,default,0,,,,,,,,,,,
